{
  "candidatesSchemaVersion": "0.3.0",
  "document": {
    "docId": "FIXTURE-POLICY-001",
    "parsedRef": {
      "path": "normalized.parsed.json",
      "parsedSchemaVersion": "0.1.0"
    },
    "tenant": "FIXTURE"
  },
  "coreVersions": {
    "proc": "0.1.0",
    "fnd": "2.0.0"
  },
  "candidates": [
    {
      "candidateId": "CAND-ART-01",
      "sourceBlock": {
        "docId": "FIXTURE-POLICY-001",
        "blockId": "b-012",
        "blockPath": "ch3/s1",
        "excerpt": "脱敏占位文本-0015"
      },
      "disposition": "process-step",
      "clauseType": [
        "process-step"
      ],
      "confidence": 0.85,
      "coreVersion": "2.0.0",
      "produces": [
        {
          "localId": "ART-01",
          "rdfType": "proc:Artifact",
          "label": "脱敏占位文本-0134"
        }
      ],
      "reviewPool": "sampled",
      "review": {
        "status": "proposed"
      }
    },
    {
      "candidateId": "CAND-ART-02",
      "sourceBlock": {
        "docId": "FIXTURE-POLICY-001",
        "blockId": "b-028",
        "blockPath": "ch4/s1",
        "excerpt": "脱敏占位文本-0031"
      },
      "disposition": "process-step",
      "clauseType": [
        "process-step"
      ],
      "confidence": 0.85,
      "coreVersion": "2.0.0",
      "produces": [
        {
          "localId": "ART-02",
          "rdfType": "proc:Artifact",
          "label": "脱敏占位文本-0098"
        }
      ],
      "reviewPool": "sampled",
      "review": {
        "status": "proposed"
      }
    },
    {
      "candidateId": "CAND-ART-03",
      "sourceBlock": {
        "docId": "FIXTURE-POLICY-001",
        "blockId": "b-013",
        "blockPath": "ch3/s1/ct/sales",
        "excerpt": "脱敏占位文本-0016"
      },
      "disposition": "process-step",
      "clauseType": [
        "process-step"
      ],
      "confidence": 0.8,
      "coreVersion": "2.0.0",
      "produces": [
        {
          "localId": "ART-03",
          "rdfType": "proc:Artifact",
          "label": "脱敏占位文本-0281"
        }
      ],
      "reviewPool": "sampled",
      "review": {
        "status": "proposed"
      }
    },
    {
      "candidateId": "CAND-ART-04",
      "sourceBlock": {
        "docId": "FIXTURE-POLICY-001",
        "blockId": "b-023",
        "blockPath": "ch3/s2/tosales",
        "excerpt": "脱敏占位文本-0026"
      },
      "disposition": "process-step",
      "clauseType": [
        "process-step"
      ],
      "confidence": 0.85,
      "coreVersion": "2.0.0",
      "produces": [
        {
          "localId": "ART-04",
          "rdfType": "proc:Artifact",
          "label": "脱敏占位文本-0286"
        }
      ],
      "reviewPool": "sampled",
      "review": {
        "status": "proposed"
      }
    },
    {
      "candidateId": "CAND-ART-05",
      "sourceBlock": {
        "docId": "FIXTURE-POLICY-001",
        "blockId": "b-024",
        "blockPath": "ch3/s2/toreturn",
        "excerpt": "脱敏占位文本-0027"
      },
      "disposition": "process-step",
      "clauseType": [
        "process-step"
      ],
      "confidence": 0.85,
      "coreVersion": "2.0.0",
      "produces": [
        {
          "localId": "ART-05",
          "rdfType": "proc:Artifact",
          "label": "脱敏占位文本-0290"
        }
      ],
      "reviewPool": "sampled",
      "review": {
        "status": "proposed"
      }
    },
    {
      "candidateId": "CAND-ART-06",
      "sourceBlock": {
        "docId": "FIXTURE-POLICY-001",
        "blockId": "b-030",
        "blockPath": "ch4/s3",
        "excerpt": "脱敏占位文本-0033"
      },
      "disposition": "process-step",
      "clauseType": [
        "process-step"
      ],
      "confidence": 0.8,
      "coreVersion": "2.0.0",
      "produces": [
        {
          "localId": "ART-06",
          "rdfType": "proc:Artifact",
          "label": "脱敏占位文本-0293"
        }
      ],
      "reviewPool": "sampled",
      "review": {
        "status": "proposed"
      }
    },
    {
      "candidateId": "CAND-ART-07",
      "sourceBlock": {
        "docId": "FIXTURE-POLICY-001",
        "blockId": "b-026",
        "blockPath": "ch3/s2/scrap",
        "excerpt": "脱敏占位文本-0029"
      },
      "disposition": "process-step",
      "clauseType": [
        "process-step"
      ],
      "confidence": 0.8,
      "coreVersion": "2.0.0",
      "produces": [
        {
          "localId": "ART-07",
          "rdfType": "proc:Artifact",
          "label": "脱敏占位文本-0296"
        }
      ],
      "reviewPool": "sampled",
      "review": {
        "status": "proposed"
      }
    },
    {
      "candidateId": "CAND-ART-08",
      "sourceBlock": {
        "docId": "FIXTURE-POLICY-001",
        "blockId": "b-042",
        "blockPath": "ch7/s1",
        "excerpt": "脱敏占位文本-0045"
      },
      "disposition": "process-step",
      "clauseType": [
        "process-step"
      ],
      "confidence": 0.8,
      "coreVersion": "2.0.0",
      "produces": [
        {
          "localId": "ART-08",
          "rdfType": "proc:Artifact",
          "label": "脱敏占位文本-0300"
        }
      ],
      "reviewPool": "sampled",
      "review": {
        "status": "proposed"
      }
    },
    {
      "candidateId": "CAND-ART-09",
      "sourceBlock": {
        "docId": "FIXTURE-POLICY-001",
        "blockId": "b-047",
        "blockPath": "ch8/s2",
        "excerpt": "脱敏占位文本-0050"
      },
      "disposition": "process-step",
      "clauseType": [
        "process-step"
      ],
      "confidence": 0.8,
      "coreVersion": "2.0.0",
      "produces": [
        {
          "localId": "ART-09",
          "rdfType": "proc:Artifact",
          "label": "脱敏占位文本-0305"
        }
      ],
      "reviewPool": "sampled",
      "review": {
        "status": "proposed"
      }
    },
    {
      "candidateId": "CAND-CTRL-01",
      "sourceBlock": {
        "docId": "FIXTURE-POLICY-001",
        "blockId": "b-013",
        "blockPath": "ch3/s1/ct/sales",
        "excerpt": "脱敏占位文本-0016"
      },
      "disposition": "risk-requirement",
      "clauseType": [
        "procedural"
      ],
      "confidence": 0.85,
      "coreVersion": "1.0.0",
      "produces": [
        {
          "localId": "CTRL-01",
          "rdfType": "risk:ControlPoint",
          "label": "脱敏占位文本-0452",
          "statement": "脱敏占位文本-0453",
          "obligationStatus": "EFFECTIVE",
          "applicability": "APPLICABLE"
        }
      ],
      "reviewPool": "sampled",
      "review": {
        "status": "proposed"
      }
    },
    {
      "candidateId": "CAND-CTRL-02",
      "sourceBlock": {
        "docId": "FIXTURE-POLICY-001",
        "blockId": "b-020",
        "blockPath": "ch3/s1/note3",
        "excerpt": "脱敏占位文本-0023"
      },
      "disposition": "risk-requirement",
      "clauseType": [
        "mandatory"
      ],
      "confidence": 0.8,
      "coreVersion": "1.0.0",
      "produces": [
        {
          "localId": "CTRL-02",
          "rdfType": "risk:ControlPoint",
          "label": "脱敏占位文本-0445",
          "statement": "脱敏占位文本-0446",
          "obligationStatus": "EFFECTIVE",
          "applicability": "APPLICABLE"
        }
      ],
      "reviewPool": "sampled",
      "review": {
        "status": "proposed"
      }
    },
    {
      "candidateId": "CAND-CTRL-03",
      "sourceBlock": {
        "docId": "FIXTURE-POLICY-001",
        "blockId": "b-046",
        "blockPath": "ch8/s1",
        "excerpt": "脱敏占位文本-0049"
      },
      "disposition": "risk-requirement",
      "clauseType": [
        "procedural"
      ],
      "confidence": 0.8,
      "coreVersion": "1.0.0",
      "produces": [
        {
          "localId": "CTRL-03",
          "rdfType": "risk:ControlPoint",
          "label": "脱敏占位文本-0454",
          "statement": "脱敏占位文本-0455",
          "obligationStatus": "EFFECTIVE",
          "applicability": "APPLICABLE"
        }
      ],
      "reviewPool": "sampled",
      "review": {
        "status": "proposed"
      }
    },
    {
      "candidateId": "CAND-CTRL-04",
      "sourceBlock": {
        "docId": "FIXTURE-POLICY-001",
        "blockId": "b-044",
        "blockPath": "ch7/s3",
        "excerpt": "脱敏占位文本-0047"
      },
      "disposition": "risk-requirement",
      "clauseType": [
        "procedural"
      ],
      "confidence": 0.8,
      "coreVersion": "1.0.0",
      "produces": [
        {
          "localId": "CTRL-04",
          "rdfType": "risk:ControlPoint",
          "label": "脱敏占位文本-0456",
          "statement": "脱敏占位文本-0457",
          "obligationStatus": "EFFECTIVE",
          "applicability": "APPLICABLE"
        }
      ],
      "reviewPool": "sampled",
      "review": {
        "status": "proposed"
      }
    },
    {
      "candidateId": "CAND-CTRL-05",
      "sourceBlock": {
        "docId": "FIXTURE-POLICY-001",
        "blockId": "b-048",
        "blockPath": "ch8/s2/level_table",
        "excerpt": "脱敏占位文本-0051"
      },
      "disposition": "risk-requirement",
      "clauseType": [
        "penalty"
      ],
      "confidence": 0.85,
      "coreVersion": "1.0.0",
      "produces": [
        {
          "localId": "CTRL-05",
          "rdfType": "risk:ControlPoint",
          "label": "脱敏占位文本-0458",
          "statement": "脱敏占位文本-0373",
          "obligationStatus": "EFFECTIVE",
          "applicability": "APPLICABLE"
        }
      ],
      "reviewPool": "sampled",
      "review": {
        "status": "proposed"
      }
    },
    {
      "candidateId": "CAND-OBJ-01",
      "sourceBlock": {
        "docId": "FIXTURE-POLICY-001",
        "blockId": "b-000",
        "blockPath": "preamble",
        "excerpt": "脱敏占位文本-0003"
      },
      "disposition": "definition",
      "clauseType": [
        "definition"
      ],
      "confidence": 0.9,
      "coreVersion": "0.1.0",
      "produces": [
        {
          "localId": "OBJ-01",
          "rdfType": "proc:ProcessObjective",
          "label": "脱敏占位文本-0269"
        }
      ],
      "reviewPool": "sampled",
      "review": {
        "status": "proposed"
      }
    },
    {
      "candidateId": "CAND-OBJ-02",